Titulo,Conteudo_Materia,tokens
Ministério da Saúde vai realizar testagem inédita da hepatite D em Roraima,"Em uma ação inédita, o Ministério da Saúde anuncia o início de um projeto piloto na região Norte para disponibilizar testes de diagnóstico e monitoramento dahepatite D, uma das formas mais graves de hepatite viral. Essa iniciativa visa preencher uma lacuna histórica no acesso ao diagnóstico, acompanhamento e tratamento dainfecçãono país. A expectativa é alcançar a totalidade das pessoas infectadas. De acordo com onovo boletim epidemiológicodo Ministério da Saúde, mais de 72% dos casos de hepatite D no Brasil estão concentrados na região Norte, o estado de Roraima registrou 1,5% dos casos. Vale ressaltar que esse vírus depende da presença dainfecçãopelo vírus da hepatite B para contaminar uma pessoa.
De acordo com dados da Organização Mundial da Saúde (OMS), ainfecçãocrônica do vírus B, que é responsável por 47% dos óbitos relacionados às hepatites virais, atingiu cerca de 296 milhões de pessoas em 2022 em todo o mundo. Somente no Brasil, segundo o boletim epidemiológico, foram 10.952 casos de hepatite B e 128 de hepatite D no mesmo ano. Em 2023, com a retomada das ações de prevenção, uma redução dos casos já foi registrada: 10.092 casos de hepatite B e 109 de hepatite D.
Da mesma forma que as outras hepatites, a do tipo D pode não apresentar sinais ou sintomas. É nesse ponto de gravidade que a pasta está investindo de forma inédita. O novo modelo de testagem vai facilitar, agilizar e aumentar a capacidade diagnóstica no país. Com o avançar do projeto, que acontece por meio de uma parceria com a Fundação Oswaldo Cruz (Fiocruz) de Rondônia, a ideia é expandir para as demais regiões.
Ainda em parceria com a Fiocruz, o Ministério da Saúde garantiu importante medida de acesso a medicamentos para tratamento da hepatite C, com a primeira aquisição e distribuição de sofosbuvir e daclatasvir para estados e municípios. Foram 800 mil unidades farmacêuticas entregues. Com essa nova opção terapêutica de tratamento, além de possibilitar um alto percentual de cura, foi possível proporcionar uma economia em torno de R$ 43 milhões para oSistema Único de Saúde (SUS), aproximadamente 33% mais barato quando comparado com o esquema anteriormente disponível.
O Ministério da Saúde atua, ainda, em ações de prevenção, principalmente com a vacinação contra hepatite A e B, e na expansão do acesso a diagnóstico e tratamento contra hepatite B e C. Com isso, a pasta espera que a eliminação dessas doenças como problema de saúde pública ocorra até 2030. Nesse sentido, o Brasil foi o primeiro país do mundo a lançar uma política governamental para eliminar ou reduzir, como problemas de saúde pública, 14 doenças e infecções que acometem, de forma mais intensa, as populações em situação de maior vulnerabilidade social. A hepatites virais estão inclusas na ação, conhecida comoBrasil Saudável.
Para acelerar essa resposta de eliminação das infecções, o Ministério da Saúde criou uma coordenação-geral específica de hepatites virais, dentro daSecretaria de Vigilância em Saúde e Ambiente. O fortalecimento da estrutura da pasta permite a continuidade do diálogo com a sociedade civil, estados e municípios. Exemplo disso é a construção de um Plano para a Eliminação das Hepatites Virais no Brasil, que será colocado em consulta pública em agosto deste ano, com o objetivo de criar uma linha de cuidado de acordo com as realidades locais. O documento foi construído de forma articulada com gestores estaduais e municipais, sociedades civil e científica, bem como com instituições nacionais e internacionais parceiras.
Cenário epidemiológico aponta redução na detecção de casos e nas mortes causadas por hepatites virais
Os dados doBoletim Epidemiológico de Hepatites Virais 2024apontam que, de 2000 a 2023, foram notificados mais de 785 mil casos no Brasil, sendo 40,6% do tipo C, 36,8% do tipo B, 21,8% do tipo A e 0,6 de hepatite D. Somente em 2023, foram mais de 28 mil novos casos, sendo 7,3% de hepatite A, 35,4% de hepatite B e 56,7% de hepatite C. Do total de casos de hepatite D, ao longo da série histórica, observou-se que 62,8% estavam entre pessoas autodeclaradas pretas ou pardas, seguidos de 17,3% de brancas, 6,6% de indígenas e 1,3% de amarelas.
As taxas de detecção de hepatites B e C apresentaram redução de 7,9% e 8,7%, respectivamente, quando comparadas a 2022. Em relação aos óbitos – com base na série histórica de 2012 a 2022 com dados do Sistema de Informação sobre Mortalidade (SIM) – é possível observar redução nas mortes relacionadas às hepatites A (36,8%), B (22,6%) e C (54,9%). A redução das mortes pode ser observada como um resultado de diversas ações, tais como introdução dos antivirais de ação direta a partir de 2015 e a introdução da vacina de hepatite A para crianças em 2014. Contudo, em 2022, a hepatite C foi a principal causa de óbitos entre as hepatites virais com 69,9%, seguida pela hepatite B com 26,1% do total.
Em 2023, cerca de sete mil pessoas iniciaram e mais de 40 mil estavam em tratamento para hepatite B. Quanto à hepatite C, cerca de 17 mil pessoas realizaram tratamento. Assim como para a hepatite B, a maioria (86%) realizou acompanhamento médico no serviço público de saúde e 98% tratou a hepatite C pela primeira vez.
Saúde investe mais de R$ 382 milhões em testes e medicamentos para hepatites virais
As hepatites virais atingem o fígado, causando alterações leves, moderadas ou graves. Na maioria das vezes são infecções silenciosas, ou seja, não apresentam sintomas. Entretanto, quando presentes, elas podem se manifestar com cansaço, febre, mal-estar, tontura, enjoo, vômitos, dor abdominal, pele e olhos amarelados, urina escura e fezes claras. O SUS disponibiliza testes rápidos e de confirmação para as hepatites B e C, bem como os respectivos tratamentos. De janeiro de 2023 a junho deste ano, o Ministério da Saúde investiu cerca de R$ 382 milhões em testes rápidos e medicamentos para hepatites virais.
Apesar de ainda não existir medicamento capaz de conferir a cura para ainfecçãopelo vírus da hepatite B, os disponíveis atualmente colaboram para o controle da carga viral e da evolução da doença, bem como para a manutenção da qualidade de vida. Quanto à hepatite C, os medicamentos disponibilizados no SUS conferem a cura em mais de 95% dos casos, com tratamentos que estão disponíveis para qualquer pessoa.
As vacinas contra hepatite A e B fazem parte do calendário nacional. A vacina da hepatite A tem esquema de uma dose aplicada aos 15 meses de vida e também está disponível nos Centros de Referência para Imunobiológicos Especiais (CRIE) com duas doses para pessoas acima de 1 ano de idade com determinadas condições de saúde. Já a vacina da hepatite B, a recomendação é que se façam quatro doses da vacina, sendo: uma ao nascer (vacina Hepatite B), e aos 2, 4 e 6 meses de idade (vacina Pentavalente). Para a população adulta, o esquema completo se dá com o registro de três doses.
Para quem tem mais de 20 anos e não sabe se tomou as três doses de hepatite B, é preciso procurar um posto de saúde para fazer o teste de hepatites. O Ministério da Saúde recomenda que todas as pessoas com mais de 40 anos façam o teste.
Campanha do Ministério da Saúde incentiva população a fazer testagem
Em 2023, o presidente da República, Luiz Inácio Lula da Silva, sancionou a lei que institui o Julho Amarelo no país, mês destinado à luta contra ashepatites virais. De acordo com o documento, também assinado pela ministra da Saúde, Nísia Trindade, a ação tem foco na conscientização sobre os riscos da doença, nas formas de prevenção, assistência, proteção e promoção dos direitos humanos. O projeto originário da lei é de autoria do atual ministro-chefe da Secretaria de Relações Institucionais da Presidência da República, Alexandre Padilha.
Em 2024, com o slogan “4 passos para eliminar a hepatite – conhecer, prevenir, testar e tratar”, a campanha será realizada nas redes sociais digitais, reforçando a importância da ampla testagem, pois, com exceção da hepatite B, as hepatites virais têm cura e o tratamento é oferecido gratuitamente pelo SUS.
Informações sobre as hepatites contribuem para tomada de decisão
A partir de agora, Ministério da Saúde também vai disponibilizar dois painéis de informação para acompanhamento dos dados da doença: oPainel de Indicadores e Dados Básicos das Hepatites nos Municípios Brasileirose oPainel de Monitoramento das Hepatites B e C.
Os dados disponibilizados foram retirados do Sistema de Controle Logístico de Medicamentos de Hepatites a partir de janeiro de 2023. Os indicadores descritos consideram as pessoas que receberam dispensação de medicamentos para o tratamento das hepatites B ou C e foram estratificados segundo região geográfica, sexo, raça-cor-etnia, escolaridade, situação de privação de liberdade ou situação de rua.
Ministério da Saúde",ação inédito ministério saúde anunciar início projeto piloto região norte disponibilizar teste diagnóstico monitoramento dahepatite forma grave hepatite viral iniciativa visar preencher lacuna histórico acesso diagnóstico acompanhamento tratamento dainfecçãono país expectativa alcançar totalidade pessoa infectar acordo onovo boletim epidemiológicodo ministério saúde caso hepatite brasil concentrado região norte roraima registrar caso valer ressaltar vírus depender presença dainfecçãopelo vírus hepatite contaminar pessoa acordo dado organização mundial saúde oms ainfecçãocrônico vírus responsável óbito relacionar hepatite viral atingir cerca milhão pessoa mundo brasil boletim epidemiológico caso hepatite hepatite ano retomada ação prevenção redução caso registrar caso hepatite hepatite mesmo hepatite apresentar sinal sintoma gravidade pasta investir inédito modelo testagem facilitar agilizar aumentar capacidade diagnóstico país avançar projeto acontecer parceria fundação oswaldo cruz fiocruz rondônia ideia expandir região parceria fiocruz ministério saúde garantir importante medida acesso medicamento tratamento hepatite aquisição distribuição sofosbuvir daclatasvir estado município unidade farmacêutico entregar opção terapêutico tratamento possibilitar alto percentual cura proporcionar economia torno milhão osistema único saúde sus aproximadamente barato comparar esquema anteriormente disponível ministério saúde atuar ação prevenção principalmente vacinação hepatite expansão acesso diagnóstico tratamento hepatite pasta esperar eliminação de esse doença problema saúde público ocorrer sentido brasil país mundo lançar política governamental eliminar reduzir problema saúde público doença infecção acometar intenso população situação vulnerabilidade social hepatite viral incluso ação comobrasil saudável acelerar resposta eliminação infecção ministério saúde criar coordenação específica hepatite viral dasecretaria vigilância saúde ambiente fortalecimento estrutura pasta permitir continuidade diálogo sociedade civil estados município construção plano eliminação hepatite viral brasil ser colocar consulta público agosto ano objetivo criar linha cuidado acordo realidade local documento construir articular gestor estadual municipal sociedade civil científico instituição nacional internacional parceira cenário epidemiológico apontar redução detecção caso morte causar hepatite viral dado doboletim epidemiológico hepatite viral apontar notificar caso brasil ser hepatite caso ser hepatite hepatite hepatite total caso hepatite longo série histórico observar estar pessoa autodeclarado preto parda seguir branca indígena amarela taxa detecção hepatite apresentar redução respectivamente comparar óbito base série histórico dado informação mortalidade observar redução morte relacionar hepatite redução morte observar resultado diversos ação introdução antiviral ação direto introdução vacina hepatite criança hepatite principal causa óbito hepatite viral seguir hepatite total cerca pessoa iniciar estar tratamento hepatite hepatite cerca pessoa realizar tratamento hepatite realizar acompanhamento médico serviço público saúde tratar hepatite saúde investir milhão teste medicamento hepatite viral hepatite viral atingir fígado causar alteração leve moderar grave infecção silencioso ser apresentar sintoma entretanto presente manifestar cansaço febre tonturo enjoo vômito dor abdominal pele olho amarelar urina escuro fez claro sus disponibilizar teste rápido confirmação hepatite respectivo tratamento janeiro junho ano ministério saúde investir cerca milhão teste rápido medicamento hepatite viral apesar existir medicamento capaz conferir cura ainfecçãopor o vírus hepatite disponível atualmente colabor controle carga viral evolução doença manutenção qualidade vida hepatite medicamento disponibilizar sus confer cura caso tratamento disponível pessoa vacina hepatite calendário nacional vacina hepatite esquema dose aplicar vida disponível centro referência imunobiológico especial crie dose pessoa acima ano idade determinado condição saúde vacina hepatite recomendação façam dose vacina ser nascer vacina hepatite idade vacino pentavalente população adultar esquema completo registro dose ano tomar dose hepatite preciso procurar posto saúde teste hepatite ministério saúde recomendar pessoa ano façam teste campanha ministério saúde incentivo população testagem presidente república luiz inácio lula silva sancionar lei instituir julho amarelo país destinar luta ashepatite viral acordo documento assinar ministra saúde nísio trindade ação foco conscientização risco doença forma prevenção assistência proteção promoção direito humano projeto originário lei autoria atual ministro chefe secretaria relação institucional presidência república alexandre padilho slogan passo eliminar hepatite conhecer prevenir testar tratar campanha ser realizar rede social digital reforçar importância amplo testagem exceção hepatite hepatite viral cura tratamento oferecer gratuitamente sus informação hepatite contribar tomada decisão ministério saúde disponibilizar painel informação acompanhamento dado doença opainel indicador dado básico hepatite município brasileirose opainel monitoramento hepatite dado disponibilizar retirar controle logístico medicamento hepatite janeiro indicador descazrr considerar pessoa receber dispensação medicamento tratamento hepatite estratificar região geográfico sexo raça cor etnio escolaridade situação privação liberdade situação rua ministério saúde
