Titulo,Conteudo_Materia,tokens
"Hepatites virais: conheça os serviços oferecidos pelo SUS para tratamento, diagnóstico e prevenção","O Ministério da Saúde estima que, no período de 2000 a 2023, foram notificados mais de 785 mil casos dehepatites viraisno Brasil. Por se tratar de uma doença silenciosa, às vezes assintomática por muitos anos, as hepatites levam a quadros graves de difícil tratamento como a cirrose hepática e o câncer de fígado.
Carmelita Alves não sabia que seu filho Cícero Carvalho, na época com 3 anos, tinha hepatite. Ela procurou o Hospital Regional de Taguatinga, em Brasília, com o filho apresentando dores no corpo, náuseas e vômitos. Ao passar pela triagem e atendimento, Cícero foi diagnosticado com a doença. “Como era vômito e o corpo estava meio mole, não imaginei que poderia ser algo mais grave. O médico pediu os exames, incluindo o de sangue e aí deu hepatite”, lembra Carmelita.
Logo após receber o diagnóstico, os médicos internaram a criança na Unidade de Tratamento Intensivo (UTI) e iniciaram o tratamento. “O sangue do Cícero ficou ralo. Ele precisou até receber doação de sangue. Agradeço a Deus e aos médicos pelo restabelecimento da saúde do meu filho”, recorda a mãe.Diagnosticar as hepatites B e C precocemente é a melhor forma de obter eficácia com o tratamento. Após um mês internado, Cícero recebeu alta e foi curado da doença. Hoje, aos 33 anos, ele é casado, tem um filho de onze anos e está à espera de outro herdeiro. Sua esposa, Silvana Mourão, já tomou a vacina contra hepatite peloSistema Único de Saúde (SUS)e está prevenida contra a doença. “Faço o pré-natal todo mês, incluindo exames e vacinas. Acredito que esse cuidado é fundamental tanto para mim como para meu filho”, afirma a moça.
Assim como Carmelita e família, os tratamentos oferecidos pelo SUS têm mudado a vida de portadores de hepatites virais. ""Quando o indivíduo descobre a doença com a eclosão dos sintomas, pode ser tarde. Por isso a importância da identificação precoce do vírus no organismo, em tempo de promover um tratamento bem-sucedido e prevenir futuros danos"", alerta Ethel Maciel, secretária deVigilância em Saúde e Ambientedo Ministério da Saúde. “Sem falar na vacinação, ter a caderneta vacinal em dia é essencial para se prevenir da doença e sua transmissão”, completa.
Sobre a hepatiteA hepatite é uma inflamação do fígado e pode ser causada por vírus, uso de alguns remédios, álcool e outras drogas, além de doenças autoimunes, metabólicas e genéticas. É umainfecçãoque atinge o fígado, causando alterações leves, moderadas ou graves.
As hepatites virais são um grave problema de saúde pública no Brasil e no mundo. No Brasil, as mais comuns são causadas pelos vírus A, B e C. Existem ainda, com menor frequência, o vírus da hepatite D (mais comum na Região Norte do país) e da hepatite E, que é menos frequente no Brasil, sendo encontrado com maior facilidade na África e na Ásia.Diagnóstico e tratamento
O SUS disponibiliza meios para diagnosticar as hepatites virais, sejam exames de sangue e testes rápidos ou laboratoriais, em qualquer unidade básica de saúde (UBS) e nos Centros de Testagem e Aconselhamento (CTA).
O tratamento da hepatite A se resume a repouso e cuidados com a dieta do paciente. Já em caso de hepatite C, a intervenção terapêutica é feita com os chamados antivirais de ação direta (DAA), geralmente por 8 ou 12 semanas, apresentando taxas de cura de mais de 95%.
A hepatite B não possui cura, mas seu tratamento com medicamentos específicos (alfapeginterferona, tenofovir e entecavir) tem por objetivo reduzir o risco de progressão da doença e complicações.Sintomas
Os sintomas podem se manifestar por meio do cansaço, febre, mal-estar, tontura, enjoo, vômitos, dor abdominal, pele e olhos amarelados, urina escura e fezes claras. Atualmente, existem testes rápidos para detecção dainfecçãopelos vírus B ou C, que estão disponíveis no SUS. Todas as pessoas precisam ser testadas pelo menos uma vez na vida para esses tipos de hepatite. Populações mais vulneráveis precisam ser testadas periodicamente.
Prevenção
Todas as hepatites virais podem ser evitadas com alguns cuidados. Para a do tipo A, o recomendado é lavar as mãos com água e sabão após ir ao banheiro, trocar fraldas e antes de cozinhar ou comer, além do uso de água tratada, saneamento básico e higienização adequada dos alimentos. Desde 2014, crianças de 15 meses até menores de 5 anos recebem a vacina pelo calendário nacional de imunização. Essa medida reduziu drasticamente a incidência de hepatite A.A vacina também está disponível para algumas populações especiais em adultos, como pessoas vivendo comHIV(PVHA), pessoas portadoras de doenças hepáticas crônicas e outras situações de imunossupressão.
Já a prevenção das hepatites B e C passa por evitar o contato com o sangue contaminado. Portanto, recomenda-se a utilização de preservativos nas relações sexuais, sempre exigir materiais esterilizados ou descartáveis e não compartilhar itens, equipamentos ou utensílios de uso pessoal.  A hepatite B também pode ser prevenida por meio da imunização, e apenas a do tipo C não possui vacina.
Transmissão
Ahepatite Aé transmitida de pessoa para pessoa pelo contato íntimo, ou através de alimentos ou água contaminados por fezes contendo o vírus. Portanto, cuidados com a higiene são fundamentais para evitar a contaminação.  Já o contágio das hepatites virais B, C e D ocorre por contato com sangue e hemoderivados, podendo também ser passadas por contato sexual e da mãe infectada para o recém-nascido.
A transmissão pode ocorrer ainda pelo compartilhamento de objetos contaminados, como lâminas de barbear, escovas de dentes e alicates.
A hepatite C tem maior taxa de detecção em indivíduos acima dos 40 anos de idade, ou que apresentem fatores de risco acrescidos, como: ter sido submetido a procedimento de hemodiálise; ter diabetes ou hipertensão; ter realizado procedimentos invasivos (estéticos ou cirúrgicos, tatuagens ou piercings) sem os devidos cuidados de biossegurança; ter realizado transfusões sanguíneas antes de 1993; compartilhar objetos para o uso de drogas, dentre outros.
Julho Amarelo
Com a chegada do Julho Amarelo - lembrado como o mês de luta contra as hepatites virais -, o Ministério da Saúde promoverá ações de visibilidade e enfrentamento à doença no período. Elas terão início nos dias 8 e 9 de julho, com o “II Seminário Diálogos para a eliminação das hepatites B e C: o caminho para eliminação e ações nos territórios”.
O objetivo do evento é promover o debate entre o ministério e as coordenações estaduais e municipais sobre os programas de hepatites virais e as ações nacionais para a eliminação das hepatites B e C como problemas de saúde pública até 2030.
Vanessa RodriguesMinistério da Saúde",ministério saúde estimo período notificar caso dehepatite viraisno brasil tratar doença silencioso assintomático ano hepatite levar quadro grave difícil tratamento cirrose hepático câncer fígado carmelita alves saber filho cícero carvalho época ano ter hepatite procurar hospital regional taguatinga brasílir filho apresentar dor corpo náuseo vômito passar triagem atendimento cícero diagnosticar doença vômito corpo mole imaginar poder grave médico pedir exame incluir sangue dar hepatite lembrar carmelito receber diagnóstico médico internar criança unidade tratamento intensivo uti iniciar tratamento sangue cícero ficar ralo precisar receber doação sangue agradeço deus médico restabelecimento saúde filho recordar mãe diagnosticar hepatite precocemente bom obter eficácia tratamento internado cícero receber alta curar doença hoje ano casado filho ano espera outro herdeiro esposo silvano mour tomar vacina hepatite pelosistema único saúde sus prevenido doença pré natal incluir exame vacina acreditar cuidado fundamental eu filho afirmar moça carmelita famíliar tratamento oferecer sus mudar vida portador hepatite viral indivíduo descobrir doença eclosão sintoma importância identificação precoce vírus organismo promover tratamento sucedido prevenir futuro dano alertar ethel maciel secretário devigilância saúde ambientedo ministério saúde falar vacinação caderneta vacinal essencial prevenir doença transmissão completo hepatitea hepatite inflamação fígado causar vírus uso remédio álcool droga doença autoimunes metabólico genética umainfecçãoque atingir fígado causar alteração leve moderar grave hepatite viral grave problema saúde público brasil mundo brasil comum causar vírus existir frequência vírus hepatite comum região norte país hepatite frequente brasil ser encontrar facilidade áfrica ásia diagnóstico tratamento sus disponibilizar meio diagnosticar hepatite viral ser exame sangue teste rápido laboratorial unidade básico saúde ubs centro testagem aconselhamento ctar tratamento hepatite resumar repouso cuidado dieta paciente caso hepatite intervenção terapêutico fazer chamado antiviral ação direto daa geralmente semana apresentar taxa cura hepatite possuir cura tratamento medicamento específico alfapeginterferonar tenofovir entecavir objetivo reduzir risco progressão doença complicação sintomo sintoma manifestar cansaço febre tonturo enjoo vômito dor abdominal pele olho amarelar urina escuro fez clara atualmente existir teste rápido detecção dainfecçãopelo vírus disponível sus pessoa precisar testar vida tipo hepatite população vulnerável precisar testar periodicamente prevenção hepatite viral evitar cuidado recomendado lavar mão água sabão banheiro trocar fralr cozinhar comer uso água tratar saneamento básico higienização adequado alimento criança pequeno ano receber vacina calendário nacional imunização medida reduzir drasticamente incidência hepatite vacina disponível população especial adulto pessoa viver comhiv pvha pessoa portadora doença hepático crônico situação imunossupressão prevenção hepatite passar evitar contato sangue contaminar recomendar utilização preservativo relação sexual exigir material esterilizar descartável compartilhar item equipamento utensílio uso pessoal hepatite prevenir imunização possuir vacina transmissão ahepatite transmitir pessoa pessoa contato íntimo alimento água contaminar fez conter vírus cuidado higiene fundamental evitar contaminação contágio hepatite viral ocorrer contato sangue hemoderivar poder passar contato sexual mãe infectar recém nascer transmissão ocorrer compartilhamento objeto contaminar lâmina barbear escova dente alicate hepatite taxa detecção indivíduo acima ano idade apresentar fator risco acrescer ser submeter procedimento hemodiálise diabete hipertensão realizar procedimento invasivo estético cirúrgico tatuagens piercings devido cuidado biossegurança realizar transfusão sanguíneo compartilhar objeto uso droga dentre julho amarelo chegada julho amarelo lembrar luta hepatite viral ministério saúde promover ação visibilidade enfrentamento doença período ter início dia julho seminário diálogo eliminação hepatite eliminação ação território objetivo evento promover debate ministério coordenação estadual municipal programa hepatite viral ação nacional eliminação hepatite problema saúde público vanessa rodriguesministério saúde
Ministério da Saúde lança campanha de carnaval com foco na prevenção às infecções sexualmente transmissíveis,"Para conscientizar a população sobre a importância do uso da camisinha para prevenção das Infecções Sexualmente Transmissíveis (IST), o Ministério da Saúde lança, nesta terça-feira (6), a campanha nacional do carnaval 2024.  Com o slogan ‘Carnaval, respeito e proteção #TemQueTer’, a campanha será veiculada na TV aberta, no rádio e em locais de grande circulação de pessoas em todo o Brasil. A estratégia inclui peças de comunicação que trazem os ritmos e a cultura de cada região do país, além de conteúdos específicos para os momentos antes, durante e depois das festas.
Outra importante forma de prevenir contra asIST, como oHIV, por exemplo, é fazendo uso da PrEP, método que consiste em tomar comprimidos antes da relação sexual, que permitem ao organismo estar preparado para enfrentar um possível contato com oHIV. A pessoa em PrEP realiza acompanhamento regular de saúde, com testagem para o HIV e outras infecções sexualmente transmissíveis. Entre os avanços conquistados em 2023 pelo Ministério da Saúde, está a disponibilização da profilaxia nos ambulatórios que acompanham a saúde de pessoas trans. Em todos os estados há serviços de saúde ofertando a PrEP.
Ainda no ano passado, a pasta investiu R$ 27 milhões na aquisição de testes rápidos que detectam sífilis eHIVem um mesmo dispositivo. A inclusão do teste inédito no Sistema Único de Saúde (SUS) fortalece o rastreio e tratamento mais ágil para a população. Inicialmente, o duo teste será direcionado para o rastreio em mulheres grávidas, trabalhadoras do sexo e homens que fazem sexo com homens. As demais pessoas serão testadas com a tecnologia que já é ofertada atualmente.
Entre as vantagens do novo teste, estão a simplificação do processo de execução, que exige apenas um reagente, e a redução do espaço necessário para armazenamento nos postos de atendimento. Assim como o rastreio que já é feito, a leitura de resultado do duo teste será de até 30 minutos, sem a necessidade de estrutura laboratorial.
Outro importante anúncio do governo federal em 2023 foi a diminuição da quantidade de comprimidos ingeridos diariamente para as pessoas que vivem com o vírus doHIV. O medicamento, agora único, combina dois antirretrovirais, ambos fornecidos pelo SUS: lamivudina e dolutegravir. O remédio facilita a vida do usuário, evita efeitos colaterais e mantém a carga viral controlada. Em janeiro de 2024, o Ministério da Saúde distribuiu 5,6 milhões de unidades do medicamento para estados e municípios.
O Comitê Interministerial para Eliminação da Tuberculose e Outras Doenças Determinadas Socialmente (CIEDDS) também integra as novidades anunciadas durante 2023. Coordenado pelo Ministério da Saúde, o grupo é inédito e vai funcionar até janeiro de 2030. Dados da pasta apontam que, entre 2017 e 2021, as doenças determinadas socialmente foram responsáveis pela morte de mais de 59 mil pessoas no Brasil. O plano de trabalho inicial inclui enfrentar 11 dessas enfermidades. A meta é que a maioria das doenças sejam eliminadas como problema de saúde pública. Para o HIV e a aids, o objetivo é atingir as metas operacionais de eliminação pactuadas internacionalmente, incluindo a eliminação da transmissão vertical deHIV, sífilis e hepatite B, quando ainfecçãoé passada de mãe para filho.
Para o carnaval 2024, o foco da campanha é lembrar aos foliões que a proteção é uma peça fundamental para a festa, lado a lado com o respeito, a diversidade e a inclusão.
Mais sobre asISTe a assistência no SUS
Ouso da camisinha externa ou interna, em todas as relações sexuais, é o método mais eficaz para proteção contra oHIVe outras infecções sexualmente transmissíveis. O Ministério da Saúde reforça que camisinhas podem ser retiradas gratuitamente nas Unidades Básicas de Saúde. AsISTsão causadas por vírus, bactérias ou outros microrganismos e transmitidas, principalmente, por meio de contato sexual com uma pessoa que esteja infectada. Atendimento, diagnóstico e tratamento estão disponíveis no SUS de forma gratuita.
Existem diversos tipos de IST. As mais conhecidas são:
-HIV;
-Sífilis;
-Herpesgenital;
-HPV;
- Gonorreia;
-Infecçãopor clamídia;
-Hepatites B e C;
-InfecçãopeloHTLV; e
- Tricomoníase.
As Infecções Sexualmente Transmissíveis aparecem, principalmente, no órgão genital, mas também podem surgir em outras partes do corpo, como palma das mãos, olhos ou língua. Elas podem se manifestar por meio de feridas, corrimentos e verrugas anogenitais, entre outros possíveis sintomas, como dor pélvica, ardência ao urinar, lesões de pele e aumento de ínguas. Ao perceber qualquer sinal ou sintoma, deve-se procurar o serviço de saúde, independentemente de quando foi a última relação sexual. É importante que não haja automedicação e que o tratamento seja prescrito por um profissional de saúde habilitado.
O Ministério da Saúde ressalta, ainda, a importância da realização de testes para diagnóstico precoce, principalmente se houver relação sexual desprotegida, pois algumas IST podem não apresentar sinais e sintomas. Caso apresente exposição sexual com risco deinfecção, o usuário deve se informar sobre a profilaxia pós-exposição (PEP), que deve ser iniciada em até 72 horas. Se não forem diagnosticadas e tratadas precocemente, algumas infecções podem levar a graves complicações. Também é de extrema relevância que as parcerias sexuais sejam alertadas sempre que uma IST for diagnosticada, para que também realizem o tratamento.
A camisinha também é um importante método contraceptivo para quem quer evitar a gravidez. Além do preservativo, o SUS oferta de maneira gratuita outros métodos que ajudam com os cuidados relacionados aos direitos sexuais e reprodutivos, como anticoncepcional injetável mensal, anticoncepcional injetável trimestral, minipílula, pílula combinada, diafragma, pílula anticoncepcional de emergência (ou pílula do dia seguinte) e o Dispositivo Intrauterino (DIU).
Você sabia?
O termo ‘Infecções Sexualmente Transmissíveis (IST)’ passou a ser adotado em substituição à expressão ‘Doenças Sexualmente Transmissíveis (DST)’, porque destaca a possibilidade de uma pessoa ter e transmitir umainfecção, mesmo sem sinais e sintomas. Além disso, se tratadas precocemente, várias infecções não se tornam doenças.
Use camisinha. Previna-se!
Ministério da Saúde",conscientizar população importância uso camisinha prevenção infecção sexualmente transmissível ist ministério saúde lançar terça feiro campanha nacional carnaval slogan carnaval respeito proteção campanha ser veicular abrir rádio local circulação pessoa brasil estratégia incluir peça comunicação trazer ritmo cultura região país conteúdo específico momento durante festa importante prevenir asist ohiv fazer uso prep método consistir tomar comprimir sexual permitir organismo preparado enfrentar contato ohiv pessoa prep realizar acompanhamento regular saúde testagem hiv infecção sexualmente transmissível avanço conquistar ministério saúde disponibilização profilaxia ambulatório acompanhar saúde pessoa tran estado serviço saúde ofertar prep ano passado pasta investir milhão aquisição teste rápido detectar sífili ehiver dispositivo inclusão teste inédito único saúde sus fortalecer rastreio tratamento ágil população inicialmente duo teste ser direcionar rastreio mulher grávido trabalhadoro sexo homem sexo homem pessoa ser testar tecnologia ofertar atualmente vantagem teste simplificação processo execução exigir reagente redução espaço necessário armazenamento posto atendimento rastreio fazer leitura resultado duo teste ser minuto necessidade estrutura laboratorial outro importante anúncio governo federal diminuição quantidade comprimir ingerir diariamente pessoa viver vírus dohivr medicamento único combina antirretroviral fornecer sus lamivudino dolutegravir remédio facilitar vida usuário evita efeito colateral manter carga viral controlar janeiro ministério saúde distribuir milhão unidade medicamento estado município comitê interministerial eliminação tuberculose doença determinar socialmente ciedds integrar novidade anunciar durante coordenar ministério saúde inédito funcionar janeiro dado pasta apontar doença determinar socialmente responsável morte pessoa brasil plano trabalho inicial incluir enfrentar de esse enfermidade meta doença ser eliminar problema saúde público hiv aids objetivo atingir meta operacional eliminação pactuar internacionalmente incluir eliminação transmissão vertical dehiv sífilis hepatite ainfecçãoé passado mãe filho carnaval foco campanha lembrar folião proteção peça fundamental festa respeito diversidade inclusão asiste assistência sus ouso camisinha externo interno relação sexual método eficaz proteção ohive infecção sexualmente transmissível ministério saúde reforçar camisinha retirar gratuitamente unidade básico saúde asistsão causar vírus bactéria microrganismo transmitidas principalmente contato sexual pessoa estar infectado atendimento diagnóstico tratamento disponível sus gratuito existir diverso tipo ist conhecida hiv sífilis herpesgenital hpv gonorreia infecçãopor clamídia hepatite infecçãopelohtlv tricomoníase infecção sexualmente transmissível aparecer principalmente órgão genital surgir parte corpo palma mão olho língua manifestar ferida corrimento verruga anogenital possível sintoma dor pélvico ardêncer urinar lesão pele aumento íngua perceber sinal sintoma procurar serviço saúde independentemente último sexual importante haver automedicação tratamento ser prescrito profissional saúde habilitar ministério saúde ressaltar importância realização teste diagnóstico precoce principalmente haver sexual desprotegir ist apresentar sinal sintoma caso apresente exposição sexual risco deinfecçãor usuário informar profilaxia pós exposição pep iniciar hora ser diagnosticar tratar precocemente infecção levar grave complicação extremo relevância parceria sexual ser alertar ist diagnosticar realizer tratamento camisinha importante método contraceptivo evitar gravidez preservativo sus oferta maneira gratuito método ajudar cuidado relacionar direito sexual reprodutivo anticoncepcional injetável mensal anticoncepcional injetável trimestral minipílular pílula combinado diafragma pílula anticoncepcional emergência pílula seguinte dispositivo intrauterino diu saber termo infecção sexualmente transmissível ist passar adotar substituição expressão doença sexualmente transmissível dst destacar possibilidade pessoa transmitir umainfecção sinal sintoma tratar precocemente várias infecção tornar doença use camisinha previno ministério saúde
