Titulo,Conteudo_Materia,tokens
"Diagnóstico precoce é fundamental para tratar a sepse, conhecida como infecção generalizada","Uma doença grave, ainda pouco conhecida pela população. A sepse, também chamada deinfecçãogeneralizada, é uma enfermidade que se não tratada de forma precoce e imediata, se espalha rapidamente pelo corpo e afeta o sistema imunológico, dificultando o funcionamento dos órgãos. Em resposta, o organismo provoca mudanças na temperatura, pressão arterial, frequência cardíaca, contagem de células brancas do sangue e respiração. Sem o tratamento adequado, pode haver parada cardíaca e falência múltipla dos órgãos levando ao óbito.
Nesta terça-feira (13), no Dia Mundial da Sepse, o Ministério da Saúde reforça a importância do diagnóstico precoce e tratamento imediato da doença, responsável por pelo menos 11 milhões de mortes por ano no mundo todo. O foco é a conscientização tanto para o profissional de saúde quanto para a sociedade, estimulando ações que melhorem a percepção, educação e o tratamento da sepse.
A sepse pode estar localizada em qualquer órgão, mas com uma boa higiene e cuidados básicos de saúde é possível evitá-la. O risco pode ser diminuído, principalmente em crianças, quando pais ou responsáveis seguem o calendário de vacinação. Ainfecçãopode ser bacteriana, fúngica, viral, parasitária ou por protozoários, mas os focos mais comumente relacionados à sepse são a pneumonia, ainfecçãourináriae ainfecçãoabdominal.
As primeiras horas de tratamento são as mais importantes. Os pacientes devem receber antibioticoterapia adequada o mais rápido possível. Culturas de sangue, bem como outras culturas de locais sob suspeita deinfecção, devem ser colhidas na tentativa de detectar o agente causador da doença. A sepse é uma emergência médica e seu tratamento deve ser priorizado.
Qualquer pessoa pode desenvolver sepse. No entanto, há grupos de risco, como os bebês prematuros e crianças abaixo de um ano, idosos acima de 65 anos, pacientes com câncer, Aids ou que fizeram uso de quimioterapia ou outros medicamentos que afetam as defesas do organismo, pacientes com doenças crônicas como insuficiência cardíaca, insuficiência renal e diabetes; usuários de álcool e drogas e pacientes hospitalizados que utilizam antibióticos, cateteres ou sondas, além de transplantados.
A sepse pode se apresentar de diversas maneiras e com sintomas decorrentes do mau funcionamento de diferentes partes do corpo. O médico deve ser acionado caso o paciente apresente febre muito alta, aumento da frequência cardíaca, respiração acelerada ou sinais como confusão, agitação, alteração do nível de consciência, dificuldades para respirar, diminuição da quantidade de urina e pressão baixa. O Sistema Único de Saúde (SUS) está preparado para atender, de forma integral e gratuita, a todos os casos de sepse.
O diagnóstico da sepse é feito com base na identificação do foco infeccioso e na presença de sinais de mau funcionamento de órgãos. Não há exames específicos, mas há exames voltados para a identificação da presença deinfecção, além de hemograma para a identificação do foco, radiografia de tórax e exames de urina.
Gustavo FrasãoMinistério da Saúde",doença grave população sepse chamar deinfecçãogeneralizar enfermidade tratar precoce imediato espalhar rapidamente corpo afetar imunológico dificultar funcionamento órgão resposta organismo provocar mudança temperatura pressão arterial frequência cardíaco contagem célula branco sangue respiração tratamento adequado haver parada cardíaca falência múltiplo órgão levar óbito terça feira mundial sepse ministério saúde reforçar importância diagnóstico precoce tratamento imediato doença responsável milhão morte ano mundo foco conscientização profissional saúde sociedade estimular ação melhor percepção educação tratamento sepse sepse localizar órgão higiene cuidado básico saúde evitá risco diminuir principalmente criança pai responsável seguir calendário vacinação ainfecçãopoder bacteriano fúngicar viral parasitário protozoário foco comumente relacionar sepse pneumonia ainfecçãourináriae ainfecçãoabdominal primeiro hora tratamento importante paciente receber antibioticoterapia adequado rápido cultura sangue cultura local suspeito deinfecção colhir tentativa detectar agente causador doença sepse emergência médico tratamento priorizar pessoa desenvolver sepse entanto grupo risco bebê prematuro criança abaixo ano idoso acima ano paciente câncer aids fazer uso quimioterapia medicamento afetar defesa organismo paciente doença crônico insuficiência cardíaco insuficiência renal diabete usuário álcool droga paciente hospitalizar utilizar antibiótico cateter sonda transplantado sepse apresentar diversos maneira sintoma decorrente mau funcionamento diferentes parte corpo médico acionar caso paciente apresente febrer alto aumento frequência cardíaco respiração acelerar sinal confusão agitação alteração consciência dificuldade respirar diminuição quantidade urina pressão baixo único saúde sus preparado atender integral gratuito caso sepse diagnóstico sepse fazer base identificação foco infeccioso presença sinal mau funcionamento órgão exame específico exame voltar identificação presença deinfecção hemograma identificação foco radiografia tórax exame urina gustavo frasãoministério saúde
Dificuldade durante a amamentação? Conheça algumas medidas que podem ajudar,"A chegada de uma criança provoca grandes mudanças na vida de uma família. Nesta nova fase, algumas das principais dificuldades podem estar relacionadas com a amamentação. As Unidades Básicas de Saúde (UBS), ambulatórios/consultórios ou clínicas de amamentação, Bancos de Leite Humano e Postos de Coleta de Leite Humano oferecem apoio para a mulher que precisa de ajuda profissional. Mesmo assim, algumas dicas podem ser úteis. Confira:
A “descida do leite” – ou apojadura – pode demorar um pouco mais para acontecer em algumas mulheres. As cesarianas eletivas (programadas), vem sendo apontadas como um fator associado a essa demora, por fatores hormonais e por dificultar a amamentação na primeira hora de vida. Os partos prematuros e a obesidade também podem interferir na descida do leite.
Nesses casos, algumas medidas podem ajudar, em especial a estimulação da mama com sucção frequente do bebê ou com extração manual. A ajuda profissional é muito importante, assim como o suporte da família e da rede de apoio.
Alguns bebês apresentam dificuldades para iniciar a amamentação nos primeiros dias de vida. Nesse momento, tanto a mulher quanto o bebê estão se adaptando às mamadas. As causas podem estar associadas à pega e posição da criança durante a amamentação ou ao uso de bicos de mamadeiras de silicone e de chupetas. O bebê também pode não conseguir abocanhar a aréola adequadamente quando a mama é muito grande, está muito cheia ou “empedrada” ou quando o mamilo é invertido ou muito plano. Além disso, é importante avaliar o frênulo lingual, que dependendo do grau, também pode interferir na amamentação.
Verifique na Caderneta da Criança se a maternidade realizou avaliação do frênulo lingual. Caso não tenha sido avaliado, deve-se procurar uma Unidade Básica de Saúde ou retornar na maternidade. Observe a pega e posição do bebê nas mamadas. Existem diversas posições para a mulher amamentar: sentada, recostada, deitada ou em qualquer outra posição que seja agradável, familiar e mais adequada ao momento.
Mãe e bebê devem se sentir confortáveis, com o corpo da criança virado para o corpo da mãe, com a cabeça e o corpo da criança alinhados, e nunca com o pescoço torcido. É importante apoiar bem o bebê, colocando o rosto da criança perto e de frente para a mama. Suspenda o uso de bicos de mamadeiras, silicone e chupetas.
Caso as mamas sejam grandes, utilize um apoio. Enquanto a criança tiver dificuldade para sugar, pode-se retirar o leite do peito de forma manual ou com bomba, de 6 a 8 vezes ao longo do dia, e oferecer ao bebê em um copo ou colher. Isso ajudará na produção de leite até que a criança volte a sugar.
A orientação de um profissional de saúde logo na primeira mamada do bebê e a verificação da língua presa são fundamentais para identificar os motivos que dificultam a amamentação e a conduta mais adequada.
Um mamilo plano ou invertido pode dificultar a amamentação, mas não precisa ser tratado como um impeditivo, pois essa limitação pode ser superada.
Primeiro, deve-se ajudar o bebê a abocanhar o mamilo e a aréola e tentar diferentes posições para facilitar a pega. Se a mama estiver muito cheia, antes de iniciar a amamentação, deve-se massagear as mamas e retirar um pouco de leite para que a aréola fique mais macia e facilitar que a criança pegue o peito.
Nos primeiros dias após o parto, a mulher pode sentir os mamilos doloridos, fator considerado normal devido ao aumento da sensibilidade das mamas no final da gestação e início da amamentação. No entanto, se o mamilo apresentar alguma fissura, deve-se procurar orientação profissional. Passada a primeira semana, a persistência dos mamilos doloridos é um sinal de alerta.
Observe a pega do bebê e tente encaixá-la de forma adequada durante a amamentação. Evite o uso de sabão, álcool ou qualquer outro produto nos mamilos. Massageie as mamas quando estiverem muito cheias e retire um pouco de leite antes da mamada, para auxiliar na prevenção de machucados.
Caso precise interromper a mamada, tire o vácuo causado pela sucção do bebê. Introduza com cuidado o dedo indicador ou mínimo no canto da boca da criança. Isso evitará que o mamilo estique e machuque.
Em caso de feridas já existentes, enxague os mamilos com água limpa pelo menos uma vez ao dia para evitar infecções e, se possível, deixe as mamas livres por alguns momentos sem atrito com o sutiã ou outro tecido.
Alguns procedimentos podem ser úteis para diminuir a dor: variar a posição das mamadas, iniciar a amamentação na mama não machucada ou menos machucada. Em casos de muita dor, a oferta de uma das mamas pode ser temporariamente suspensa e a retirada do leite pode ser realizada de forma manual para evitar o “leite empedrado” ou a mastite.
Não é recomendado o uso de cremes, óleos, antissépticos, chás ou outras substâncias sobre as mamas na tentativa de aliviar a dor. Caso necessário, procure orientação profissional.
Outra dificuldade comum, principalmente nos primeiros dias de amamentação, é quando a mama produz mais leite do que o bebê consegue mamar. O problema aparece quando a mama fica muito cheia a ponto de a pele ficar esticada, causando muitas vezes o endurecimento da mama ou a presença de alguns caroços. Esse processo é denominado ingurgitamento mamário e chamado popularmente de “leite empedrado”. Em situações mais graves, as mamas podem ficar doloridas, inchadas e com a pele avermelhada e brilhante, podendo provocar febre e mal-estar.
Primeiro, deixe o bebê mamar sempre que quiser, sem horários restritos e sem pressa. Outras alternativas que podem ajudar: faça massagens com suaves movimentos circulares, iniciando sempre ao redor da aréola e retire um pouco de leite da mama para facilitar a pega.
É a inflamação da mama, que pode progredir ou não para umainfecção. Pode acontecer quando o leite fica muito tempo parado no peito e/ou através da rachadura no mamilo, que funciona como uma porta de entrada para bactérias.
A mulher com sintomas de mastite deve procurar imediatamente um serviço de saúde para realizar o tratamento adequado. A amamentação não precisa ser interrompida durante o tratamento.
Ductos lactíferos são os canais por onde o leite passa dentro da mama. Eles podem ficar bloqueados quando o leite produzido numa determinada área, por algum motivo, não é drenado. Isso ocorre com frequência quando a mama não é esvaziada corretamente, ou seja, quando as mamadas são muito espaçadas ou quando o bebê não consegue remover o leite de maneira eficaz. Pode ser causado também quando existe pressão local, como um sutiã muito apertado, ou o uso de cremes nos mamilos, obstruindo os poros de saída do leite. O bloqueio de ductos lactíferos pode se manifestar a partir de caroços localizados, sensíveis e dolorosos, acompanhados de vermelhidão e calor na área afetada.
Qualquer medida que favoreça o esvaziamento da mama ajuda na prevenção do bloqueio de ductos lactíferos. Quando o bloqueio já aconteceu, mamadas frequentes, massagem, esvaziamento das mamas e utilização de distintas posições para amamentar podem ajudar a resolver o problema.
A falsa sensação de ter pouco leite é a principal razão para a oferta de outros leites e alimentos ao bebê. Mas é preciso destacar que a maioria das mulheres produz leite suficiente para oferecer à criança em todas as etapas da amamentação. Choro ou outras reações de insatisfação do bebê não significam necessariamente que a mãe esteja com pouco leite. Se o bebê demonstra estar satisfeito após as mamadas, é ativo, responde aos estímulos, urina várias vezes ao dia (no mínimo 6 vezes) e está crescendo, ganhando peso e se desenvolvendo adequadamente, de acordo com a avaliação médica, não há problemas com a quantidade de leite.
Caso essa sensação de baixa produção de leite persista, algumas medidas podem ajudar:
É o caso de mulheres que produzem mais leite do que o bebê consegue consumir. Não é um problema, mas pode provocar algumas dificuldades na amamentação. A criança pode ficar irritada, arquear o corpo para trás durante a mamada, engasgar, regurgitar ou ter gases e cólicas.
Algumas medidas podem ser tomadas para evitar a hiperlactação:
Independente da situação, a mulher precisa e deve receber apoio da família, da sua rede de apoio e dos profissionais de saúde para manter a amamentação.
Fran MartinsMinistério da Saúde",chegada criança provocar mudança vida família fase principal dificuldade relacionar amamentação unidade básico saúde ubs ambulatório consultório clínica amamentação banco leite humano posto coleta leite humano oferecer mulher precisar ajuda profissional dica útil confirar descida leite apojadura demorar acontecer mulher cesariana eletivo programar ser apontar fator associar demora fator hormonal dificultar amamentação hora vida parto prematuro obesidade interferir descida leite em esse caso medida ajudar especial estimulação mama sucção frequente bebê extração manual ajuda profissional importante suporte família rede bebê apresentar dificuldade amamentação primeiro dia vida mulher bebê adaptar mamar causa associar pega criança durante amamentação uso bico mamadeira silicone chupeta bebê conseguir abocanhar aréola adequadamente mama cheio empedrar mamilo inverter plano importante avaliar frênulo lingual depender grau interferir amamentação verificar caderneta criança maternidade realizar avaliação frênulo lingual caso ter ser avaliar procurar unidade básico saúde retornar maternidade observer pega bebê mamada existir diversos posição mulher amamentar sentar recostar deitar ser agradável familiar adequado mãe bebê sentir confortável corpo criança virar corpo mãe cabeça corpo criança alinhar pescoço torcir importante apoiar bebê colocar rosto criança frente mama suspendar uso bico mamadeira silicone chupeta caso mama ser utilizar criança ter dificuldade sugar retirar leite peito manual bomba longo oferecer bebê copo colher ajudar produção leite criança voltar sugar orientação profissional saúde mamada bebê verificação língua prês fundamental identificar motivo dificultar amamentação conduta adequado mamilo plano inverter dificultar amamentação precisar tratar impeditivo limitação superar ajudar bebê abocanhar mamilo aréola diferente posição facilitar pega mama estar cheio amamentação massagear mama retirar leite aréola ficar macio facilitar criança pegar peito primeiro dia parto mulher sentir mamilo dolorir fator considerar normal devido aumento sensibilidade mama gestação início amamentação entanto mamilo apresentar algum fissura procurar orientação profissional passado semana persistência mamilo dolorir sinal alerta observir pega bebê encaixá adequado durante amamentação evitar uso sabão álcool outro produto mamilo massageie mama estar cheia retire leite mamada auxiliar prevenção machucado caso precise interromper mamada tirar vácuo causar sucção bebê introduza cuidado dedo indicador mínimo canto boca criança evitar mamilo estique machuque caso ferida existente enxague mamilo água limpa evitar infecção deixar mama livre momento atrito sutiã outro tecido procedimento útil diminuir dor variar mamada amamentação mama machucar machucar caso muito dor oferta mama temporariamente suspender retirada leite realizar manual evitar leite empedrar mastite recomendar uso creme óleo antisséptico chásr substância mama tentativa aliviar dor caso necessário procurar orientação profissional dificuldade comum principalmente primeiro dia amamentação mama produzir leite bebê conseguir mamar problema aparecer mama ficar cheio pele ficar esticar causar muito endurecimento mama presença caroço processo denominar ingurgitamento mamário chamar popularmente leite empedrar situação grave mama ficar dolorir inchar pele avermelhar brilhante poder provocar febre deixar bebê mamar querer horário restrito pressa alternativa ajudar fazer massagem suave movimento circular iniciar redor aréola retirar leite mama facilitar pega inflamação mama progredir umainfecção acontecer leite ficar parar peito rachadura mamilo funcionar porta entrada bactéria mulher sintoma mastite procurar imediatamente serviço saúde realizar tratamento adequado amamentação precisar interromper durante tratamento ducto lactífero canal leite passar mama ficar bloqueado leite produzir determinado algum motivo drenar ocorrer frequência mama esvaziar corretamente ser mamada espaçado bebê conseguir remover leite maneira eficaz causar existir pressão sutiã apertar uso creme mamilo obstruir poro saída leite bloqueio ducto lactífero manifestar caroço localizar sensível doloroso acompanhar vermelhidão calor afetar medida favoreçar esvaziamento mama ajudar prevenção bloqueio ducto lactífero bloqueio acontecer mamar frequente massagem esvaziamento mama utilização distinto posição amamentar ajudar resolver problema falso sensação leite principal razão oferta leite alimento bebê preciso destacar mulher produzir leite suficiente oferecer criança etapa amamentação chorar reação insatisfação bebê significar necessariamente mãe estar leite bebê demonstrar satisfeito mamada ativo responde estímulo urinar várias pequeno crescer ganhar peso desenvolver adequadamente acordo avaliação médico problema quantidade leite caso sensação baixo produção leite persista medida ajudar caso mulher produzir leite bebê conseguir consumir problema provocar dificuldade amamentação criança ficar irritado arquear corpo trás durante mamar engasgar regurgitar gase cólico medida tomar evitar hiperlactação independente situação mulher precisar receber família rede profissional saúde manter amamentação fran martinsministério saúde
