Titulo,Conteudo_Materia,tokens
Tuberculose: os desafios do tratamento contínuo,"De cada 10 pessoas que iniciam o tratamento, pelo menos uma abandona os medicamentos.A interrupção traz complicações que podem levar a óbito
A tuberculose é considerada uma das 10 principais causas de morte no mundo. No Brasil são registradas por ano cerca de 4,5 mil mortes pela doença. Apesar de ter cura, o abandono do tratamento é o principal motivo para a tuberculose ainda continuar fazendo vítimas fatais. O tratamento é gratuito, ofertado no Sistema Único de Saúde (SUS) e dura, em média, seis meses. Apesar da melhora dos sintomas já nas primeiras semanas após início, a cura só é garantida ao final do esquema terapêutico.
A interrupção do tratamento antes da conclusão pode levar o paciente à resistência aos antibióticos ou mesmo a complicações que podem levar a óbito. Além disso, pode aumentar o risco de transmissão da doença para outras pessoas. A transmissão ocorre por via respiratória através do espirro, tosse ou fala quando partículas expelidas no ar, que contenham a bactéria causadora da doença (Mycobacterium tuberculosisou bacilo de Koch), são inaladas por outra pessoa.
No Brasil, de cada 10 pessoas que iniciam o tratamento, pelo menos uma abandona o uso dos medicamentos. O esquema básico consiste na administração de medicamentos em doses combinadas fixas, ou seja, 4 em 1 (rifampicina, isoniazida, pirazinamida e etambutol) durante dois meses, seguida de 2 medicamentos em 1 (rifampicina e isoniazida) durante quatro meses.
Para favorecer a adesão, o Ministério da Saúde recomenda que o tratamento seja acompanhado por profissionais da unidade de saúde mais próxima do cidadão. É o chamado Tratamento Diretamente Observado (TDO), que prevê a supervisão por um profissional de saúde da tomada dos medicamentos, além de orientações claras sobre as características da doença e os riscos da interrupção do tratamento para a pessoa, familiares e comunidade.
“A melhora a partir do início do tratamento não é sinônimo de cura. A cura só vem com o tempo de tratamento, que precisa ser seguido até o final, e a confirmação por exame laboratorial”, afirma a coordenadora do Departamento de Vigilância das Doenças de Transmissão Respiratória de Condições Crônicas do Ministério da Saúde, Denise Arakaki.
Por isso, o tratamento diário e contínuo é fundamental para a cura da doença, que teve 75 mil novos casos registrados no ano passado no país. Para saber mais sobre os riscos do abandono do tratamento confira abaixo o bate-papo com coordenadora do Departamento de Vigilância das Doenças de Transmissão Respiratória de Condições Crônicas, Denise Arakaki.
Coordenadora do Departamento de Vigilância das Doenças de Transmissão Respiratória de Condições Crônicas,Denise Arakaki:
- O que leva as pessoas a abandonarem o tratamento?
Denise Arakaki:Pela forte determinação social, a maior prevalência da doença é em países em desenvolvimento. O perfil clássico de quem tem tuberculose é de pessoas de classe baixa que acumulam vulnerabilidades sociais, econômicas e biológicas, moram às margens das grandes cidades urbanas, trabalham na informalidade ou percorrem longas distâncias para chegarem ao trabalho. Quando essas pessoas começam o tratamento para tuberculose ficam bem nas primeiras semanas. Voltam a seu peso normal, o cansaço diminui e o apetite melhora. Por isso, acham que já estão curadas e abandonando o tratamento.
Mas essa melhora a partir do início do tratamento não é sinônimo de cura. A cura só vem com o tempo de tratamento, que precisa ser seguido até o final, tendo a confirmação de cura por exame laboratorial e avaliação clínica.
- Quais as consequências da interrupção do tratamento?
Denise Arakaki:Quando a pessoa interrompe o tratamento da tuberculose no meio do processo terapêutico a doença retorna e tem possibilidade de voltar com bacilosresistentes aos medicamentos. Além disso, condições sociais como, ser morador de rua ou estar em privação de liberdade, ou mesmo ser portador de doenças imunodeprimidas, como HIV/Aids, podem agravar o quadro de tuberculose e levar a óbito.
- O Brasil ainda possui percentuais elevados de abandono se comparado a outros países?
Denise Arakaki:Os percentuais no Brasil ainda estão acima da meta preconizada pela Organização Mundial da Saúde (OMS), que é de 5%. O percentual de pessoas que abandonam o tratamento no país chega a 10%, o que representa cerca de sete mil pessoas.
- Como é feito o tratamento da tuberculose? É diário ou intermitente?
Denise Arakaki:Quando realizado o tratamento adequado e de forma correta, a tuberculose tem cura de praticamente 100% dos casos que são causados por bacilos sensíveis. O tratamento é oferecido exclusivamente pelo Sistema Único de Saúde e deve ser feito diariamente, sem interrupção, com duração de pelo menos 6 meses para bacilos sensíveis e de 18 meses para osresistentes. Utilizamos quatro fármacos no tratamento dos casos de tuberculose no esquema básico (sensível): rifampicina, isoniazida, pirazinamida e etambutol.
- Mesmo após início do tratamento, as pessoas que têm tuberculose precisam ficar isoladas do contato com outras pessoas?
Denise Arakaki:Após o início do tratamento, em geral após 15 dias, a chance de transmissão é muito reduzida. A pessoa com tuberculose não deve ficar isolada, pelo contrário, precisa do apoio de familiares e amigos para seguir com o tratamento. A doença não é transmitida por objetos ou utensílios compartilhados, como pratos ou colheres, ou mesmo roupas ou lençóis. Isso porque, somente os bacilos dispersos no ar em aerossóis podem transmitir a doença. A transmissão ocorre por via respiratória através do espirro, tosse ou fala.
Por isso é muito importante adotar algumas medidas até que haja a negativação da bactéria no organismo, como cobrir a boca com o braço ou lenço ao tossir, manter o ambiente com bastante luz solar e bem ventilado, porque a circulação de ar possibilita a dispersão das partículas infectantes.
- Como é possível prevenir a tuberculose?
Denise Arakaki:A vacina BGC, ofertada gratuitamente no SUS ao nascer ou, no máximo, até os quatro anos incompletos de idade é uma maneira de prevenir a tuberculose em crianças. Porém, essa vacina protege somente contra as formas mais graves da doença, como tuberculose miliar e a meníngea.
Outra maneira de prevenção da doença é identificar, diagnosticar e tratar as pessoas que estão infectadas pelo bacilo, mas que ainda não desenvolveram a doença, chamada de infecção latente da tuberculose (ILTB). O tratamento desses casos diminui o risco de desenvolvimento da tuberculose ativa e, consequentemente, a transmissibilidade da doença.
Os sintomas da tuberculose mais comuns são tosse persistente por três semanas ou mais, febre nos períodos da tarde, suor noturno e emagrecimento sem causa aparente. Se você conhece alguém ou mesmo possui esses sintomas, é muito importante procurar a unidade de saúde mais próxima para avaliação e diagnóstico. Assim, você se protege, protege quem você ama e nos ajuda a eliminar a doença de circulação.
Por Amanda Costa e Jéssica Cerilo, da Agência SaúdeAtendimento à Imprensa(61) 3315-3580 / 3853",pessoa inicir tratamento abandonar medicamento interrupção trazer complicação levar óbito tuberculose considerar principal causa morte mundo brasil registrar ano cerca morte doença apesar cura abandono tratamento principal motivo tuberculose continuar fazer vítima fatal tratamento gratuito ofertar único saúde sus dura média apesar melhora sintoma primeiro semana início cura garantido esquema terapêutico interrupção tratamento conclusão levar paciente resistência antibiótico complicação levar óbito aumentar risco transmissão doença pessoa transmissão ocorrer via respiratório espirro tosse falar partícula expelir contenhar bactéria causador doença mycobacterium tuberculosisar bacilo koch inalar pessoa brasil pessoa inicir tratamento abandonar uso medicamento esquema básico consistir administração medicamento dose combinar fixa ser rifampicino isoniazer pirazinamida etambutol durante seguir medicamento rifampicino isoniazer durante favorecer adesão ministério saúde recomendar tratamento ser acompanhar profissional unidade saúde cidadão chamado tratamento diretamente observar tdo prever supervisão profissional saúde tomada medicamento orientação claro característica doença risco interrupção tratamento pessoa familiar comunidade melhora início tratamento sinônimo cura cura tratamento precisar seguir confirmação exame laboratorial afirmar coordenadora departamento vigilância doença transmissão respiratório condição crônico ministério saúde denise arakaki tratamento diário contínuo fundamental cura doença caso registrar ano passado país risco abandono tratamento confirar abaixo bate papo coordenadora departamento vigilância doença transmissão respiratório condição crônico denise arakaki coordenadora departamento vigilância doença transmissão respiratório condição crônico denise arakaki levar pessoa abandonar tratamento denise arakaki forte determinação social prevalência doença país desenvolvimento perfil clássico tuberculose pessoa classe baixo acumular vulnerabilidade social econômico biológica morar margem cidade urbano trabalhar informalidade percorr longo distância chegar trabalho pessoa começar tratamento tuberculose ficar primeiro semana voltar peso normal cansaço diminuir apetite melhorar achar curado abandonar tratamento melhora início tratamento sinônimo cura cura tratamento precisar seguir ter confirmação cura exame laboratorial avaliação clínico consequência interrupção tratamento denise arakaki pessoa interrompe tratamento tuberculose processo terapêutico doença retorno possibilidade voltar bacilosresistente medicamento condição social morador rua privação liberdade portador doença imunodeprimido hiv aids agravar quadro tuberculose levar óbito brasil possuir percentual elevar abandono comparar país denise arakaki percentual brasil acima meta preconizar organização mundial saúde oms percentual pessoa abandonar tratamento país chegar representar cerca pessoa fazer tratamento tuberculose diário intermitente denise arakaki realizar tratamento adequado corretar tuberculose cura praticamente caso causar bacilo sensível tratamento oferecer exclusivamente único saúde fazer diariamente interrupção duração bacilo sensível osresistente utilizamos fármaco tratamento caso tuberculose esquema básico sensível rifampicino isoniazer pirazinamida etambutol início tratamento pessoa tuberculose precisar ficar isolar contato pessoa denise arakaki início tratamento dia chance transmissão reduzir pessoa tuberculose ficar isolar contrário precisar familiar amigo seguir tratamento doença transmitir objeto utensílio compartilhar prato colher roupa lençóis bacilo dispersar aerossóis transmitir doença transmissão ocorrer via respiratório espirro tosse falar importante adotar medida haver negativação bactéria organismo cobrir boca braço lenço tossir manter ambiente luz solar ventilado circulação possibilito dispersão partícula infectante prevenir tuberculose denise arakaki vacina bgc ofertar gratuitamente sus nascer ano incompleto idade maneira prevenir tuberculose criança vacina proteger forma grave doença tuberculose miliar meníngea maneira prevenção doença identificar diagnosticar tratar pessoa infectado bacilo desenvolver doença chamar infecção latente tuberculose iltb tratamento de esse caso diminuir risco desenvolvimento tuberculose ativo consequentemente transmissibilidade doença sintoma tuberculose comum tor persistente semana febre período suor noturno emagrecimento causa aparente conhecer alguém possuir sintoma importante procurar unidade saúde avaliação diagnóstico proteger proteger amar ajudar eliminar doença circulação amanda costa jéssico cerilo agência saúdeatendimento imprensa
Hanseníase sem estigma,"Há relatos históricos que mostram que a hanseníase parece acometer ao homem desde a antiguidade. A enfermidade já foi motivo de estigma e exclusão. Atualmente, faz parte do rol de doenças consideradas negligenciadas e que requer ação estratégica das políticas de saúde públicas.
Há mais de 20 anos, a doença tem tratamento oferecido pelo SUS capaz de curar a totalidade dos casos. Neste mês é o lançamento da campanha de conscientização sobre a doença. Duas datas comemorativas marcam o Janeiro Roxo, como ficou conhecido o marco no calendário da Saúde: o dia Mundial de Luta contra a Hanseníase e o dia nacional, 28 e o último domingo do primeiro mês do ano.
Hanseníase é uma doença transmissível causada por um bacilo que é uma bactéria. Atransmissãoé por meio das secreções das vias respiratórias e pelas gotículas de saliva da pessoadoente sem tratamento. O contato direto e prolongado com o doente em ambiente fechado, com pouca ventilação e pouca luz solar, aumenta as chances de se infectar com o bacilo da hanseníase. A doença progride lentamente. Entre o contato com a pessoa doente e o aparecimento dos primeiros sinais, pode levar em média dois a cinco anos.
A maioria das pessoas éresistenteao bacilo e não adoece. Se diagnosticada precocemente e tratada corretamente, não incapacita para o trabalho, podendo o portador levar uma vida normal. E isso é muito importante porque a pessoa com hanseníase deixa de transmitir a doença logo que começa o tratamento.
O diagnóstico de caso de hanseníase deve ser feito na Atenção Básica. Por meio de um exame clínico, é possível identificar lesões ou áreas de pele com alteração de sensibilidade, entre outras manifestações da doença. Os nervos cutâneos (da pele) também são atingidos, provocando manchas ou áreas adormecidas na pele. Pode também afetar os olhos e, eventualmente, outros órgãos. É comum aparecerem caroços ou inchaços no rosto, orelhas, cotovelos e mãos; entupimento constante do nariz, com um pouco de sangue e feridas; alteração na musculatura das mãos, que resulta nas chamadas ""mãos de garra"".
Deve-se abordar, no atendimento, a presença dos sinais e sintomas, acolher as dúvidas e impressões do paciente, bem como realizar a avaliação de incapacidades e registrar essas informações no Prontuário do Cidadão. A avaliação do grau de incapacidades ajudará a equipe de saúde a identificar em que grau está realizando o diagnóstico e atuar na tentativa de identificar a doença o mais precoce possível.
É importante que a área de atuação da equipe seja intensificada onde há casos de pessoas com sinais e sintomas compatíveis com hanseníase. A busca ativa auxilia no diagnóstico precoce e no controle da doença. Ao conhecer melhor as demandas do território, a equipe consegue se organizar estrategicamente no combate a doença.
A Política Nacional de Atenção Básica (PNAB) preconiza ações de Vigilância em Saúde sob a responsabilidade das equipes de Atenção Básica, ressaltando o importante e necessário papel dos profissionais para realização do cuidado integral aos cidadãos. O desenvolvimento das atividades de promoção da saúde, de prevenção das doenças, agravos e de vigilância à saúde, por meio de visitas domiciliares, ações educativas individuais e coletivas, consultas, entre outras, tem seu resultado ampliado quando integrado com a atuação das equipes de Vigilância em Saúde. OGuia Política Nacional de Atenção Básica – Módulo 1 : Integração Atenção Básica e Vigilância em Saúdetraz algumas orientações para auxiliar nesse trabalho em conjunto.
Trabalho da Equipe de Saúde da Família
A orientação ao usuário é que busque atendimento na Unidade Básica de Saúde (UBS) quando se queixar de manchas sem sensibilidade local ou pontos do corpo sem manchas, mas sem sensibilidade tátil ou de outros sintomas que podem se manifestar. É necessário também avaliar toda e qualquer pessoa que resida ou tenha residido com o doente de hanseníase nos últimos cinco anos (contatos intradomiciliares) para avaliação na unidade. Mesmo que o familiar, por exemplo, não tenha desenvolvido a doença, precisa ser orientado sobre o autoexame, mesmo depois da avaliação feita pela equipe.
A informação sobre a classificação operacional é fundamental para selecionar o esquema de tratamento adequado. Para isso, o profissional médico pode consultar oGuia de Vigilância em Saúde, caso tenha dúvidas sobre como tratar o paciente portador de hanseníase. A alta por cura é dada após a administração do número de doses preconizado pelo esquema terapêutico, dentro do prazo recomendado.
A pessoa com hanseníase deverá ser agendada periodicamente para cada 28 dias para a realização da dose supervisionada. A data de retorno e o controle da adesão ao tratamento devem ser registrados em um cartão de agendamento, de uso do paciente e prontuário do cidadão. No ato do comparecimento à UBS, o paciente deve ser reavaliado pelo médico e/ou enfermeiro.
O tratamento da hanseníase é eminentemente ambulatorial, utiliza os esquemas terapêuticos padronizado — poliquimioterápicos (PQT), e está disponível nas unidades públicas de saúde definidas pelos municípios para o tratamento do doente com hanseníase. A PQT mata o bacilo e evita a evolução da doença, levando à cura. O bacilo morto é incapaz de infectar outras pessoas, rompendo a cadeia epidemiológica da doença.
Material para consulta
Guia de Vigilância em Saúde
Guia Política Nacional de Atenção Básica – Módulo 1 : Integração Atenção Básica e Vigilância em Saúde
Estratégia Global para Hanseníase 2016-2020
Confiraamensagem do Ministro Luiz Henrique Mandettano dia de Enfretamento da Hanseníase.",relato histórico mostrar hanseníase acometer homem antiguidade enfermidade motivo estigma exclusão atualmente rol doença considerar negligenciar requerer ação estratégico política saúde público ano doença tratamento oferecer sus capaz curar totalidade caso lançamento campanha conscientização doença data comemorativo marcar janeiro roxo ficar marco calendário saúde mundial luta hanseníase nacional domingo ano hanseníase doença transmissível causar bacilo bactéria atransmissãoér secreção via respiratório gotícula salivo pessoadoente tratamento contato direto prolongar doente ambiente fechar ventilação luz solar aumentar chance infectar bacilo hanseníase doença progride lentamente contato pessoa doente aparecimento primeiro sinal levar média ano pessoa éresistenteao bacilo adoecer diagnosticar precocemente tratar corretamente incapacitar trabalho poder portador levar vida normal importante pessoa hanseníase deixar transmitir doença começar tratamento diagnóstico caso hanseníase fazer atenção básico exame clínico identificar lesão área pele alteração sensibilidade manifestação doença nervo cutâneo pele atingir provocar mancha área adormecir pele afetar olho eventualmente órgão comum aparecer caroço inchaço rosto orelha cotovelo mão entupimento constante nariz sangue ferida alteração musculatura mão resultar chamado mão garra abordar atendimento presença sinal sintoma acolher dúvida impressão paciente realizar avaliação incapacidade registrar informação prontuário cidadão avaliação grau incapacidade ajudar equipe saúde identificar grau realizar diagnóstico atuar tentativa identificar doença precoce importante atuação equipe ser intensificar caso pessoa sinal sintoma compatível hanseníase busca ativo auxilio diagnóstico precoce controle doença conhecer melhor demanda território equipe conseguir organizar estrategicamente combate doença política nacional atenção básico pnab preconizar ação vigilância saúde responsabilidade equipe atenção básico ressaltar importante necessário papel profissional realização cuidado integral cidadão desenvolvimento atividade promoção saúde prevenção doença agravo vigilância saúde visita domiciliar ação educativo individual coletiva consulta resultado ampliar integrar atuação equipe vigilância saúde oguia político nacional atenção básica módulo integração atenção básico vigilância saúdetraz orientação auxiliar trabalho conjunto trabalho equipe saúde família orientação usuário busque atendimento unidade básico saúde ubs queixar mancha sensibilidade corpo mancha sensibilidade tátil sintoma manifestar necessário avaliar pessoa resida ter resider doente hanseníase último ano contato intradomiciliar avaliação unidade familiar ter desenvolver doença precisar orientar autoexame avaliação fazer equipe informação classificação operacional fundamental selecionar esquema tratamento adequado profissional médico consultar oguia vigilância saúde caso ter dúvida tratar paciente portador hanseníase alta cura dar administração dose preconizar esquema terapêutico prazo recomendar pessoa hanseníase agendar periodicamente dia realização dose supervisionar data retorno controle adesão tratamento registrar cartão agendamento uso paciente prontuário cidadão ato comparecimento ubs paciente reavaliar médico enfermeiro tratamento hanseníase eminentemente ambulatorial utilizar esquema terapêutico padronizar poliquimioterápico pqt disponível unidade público saúde definir município tratamento doente hanseníase pqt matar bacilo evito evolução doença levar cura bacilo morto incapaz infectar pessoa romper cadeia epidemiológico doença material consulta guia vigilância saúde guia político nacional atenção básica módulo integração atenção básico vigilância saúde estratégia global hanseníase confiraamensagem ministro luiz henrique mandettano enfretamento hanseníase
